{
  "claim_scope": "finite_exact_action_open_composition",
  "evidence_id": "nmlt-open-composition-evidence-v1:sha256:1494b57bc228fef71a04803cf3dd14fc8a4e5a9210b5a3f055973be7fd686d60",
  "executable_correspondence": {
    "rust_checker": "related_nonidentical_finite_instance_checker",
    "verified": false
  },
  "limitations": [
    "No weak hiding or label-map congruence theorem.",
    "No payload-type, capability, grade, fairness, divergence, or liveness preservation.",
    "No temporal or circular assume/guarantee contract semantics.",
    "No Rust/Lean correspondence or compiler-correctness theorem.",
    "Lean permits arbitrary whole wiring relations; Rust requires one-to-one connections.",
    "The positive theorem is one-sided and requires state-surjective exact-action refinement."
  ],
  "schema_version": "1.0.0",
  "sources": {
    "checker_source_id": "nmlt-source-v1:sha256:24bf341fe61c1dd1258cb420b7c57222f8b9cb212e0fc45085d2f59276f69fca",
    "ci_workflow_source_id": "nmlt-source-v1:sha256:071a011e8c01e78a3b612d79e6928298fe5e51a95890a8031ff28ec52b987b66",
    "entries": [
      {
        "path": "mechanization/lean/NMLT.lean",
        "sha256": "5d390d388c3ac0ce2475b70b8e4762ac32556665d8defc565a1754a0d3123f6e"
      },
      {
        "path": "mechanization/lean/NMLT/Behavior/OpenComposition.lean",
        "sha256": "de68188b17f180dac387aab58a6691a5a38ac1ab29d50cc5a28dcac370c116ff"
      },
      {
        "path": "mechanization/lean/NMLT/Behavior/Refinement.lean",
        "sha256": "f94f78bc4a4844abd6cf691c4ace7e8df5009646d68f81b57fbeae62157baa58"
      },
      {
        "path": "mechanization/lean/NMLT/Behavior/TemporalTyping.lean",
        "sha256": "a76ea31e5c707e881a8bada7e06ce17a96a365b8e87594216ec8cb5f2ea5371d"
      },
      {
        "path": "mechanization/lean/NMLT/Core/Transition.lean",
        "sha256": "02e2feb7933151e4b0357c9d9f9c33ab7ce7f703482ef2d172346bc9b9a4ecef"
      },
      {
        "path": "mechanization/lean/NMLT/Counterexamples/CompositionCongruence.lean",
        "sha256": "9bd13fd92511336eb1d1217fca0f291225c0bd9adf8f22f034967f2bfdaaf0f6"
      },
      {
        "path": "mechanization/lean/lake-manifest.json",
        "sha256": "e76701ed7a638be47d93a7c71c970a833728dd017ad38c4ebdae4cfc8a1784d2"
      },
      {
        "path": "mechanization/lean/lakefile.toml",
        "sha256": "7220c1d89a71ab7a46568bfbaaef88037581edb650e228882c2397717638a33f"
      },
      {
        "path": "mechanization/lean/lean-toolchain",
        "sha256": "d98505f0e331ec8d3670abfe7b3e7f179f56a9ee827cd38b0c113a6e69c4b3fb"
      }
    ],
    "evidence_checker_source_id": "nmlt-source-v1:sha256:b2399838f88b75c115d7f7b11d1e51b80d6be3054f883eab4d12a3810a2b8a95",
    "nanoda_checker_source_id": "nmlt-source-v1:sha256:fc0891182effa2f881be151b4519975c044965793a2aded2207f1ebceefd75ce",
    "root_source_id": "nmlt-source-v1:sha256:b5784f43212b31194abd9043172c86d181da404635c7b54f5d713ce83946adc1",
    "schema_source_id": "nmlt-source-v1:sha256:f9d91ecd72beced1e29eb5a2b7290d3fd4d2293f22be269942fa43c71bdf16c6",
    "schema_validator_source_id": "nmlt-source-v1:sha256:5721b737dd25c929c544a27a52543aa777965356fe24fa0f3c0c337209ad974a",
    "source_set_id": "nmlt-open-composition-source-set-v1:sha256:bd6b7dcb3e1fee7a453743a78fd5c8b2bdd16d4475ff42e6fc84f5b9cebb07a6",
    "trusted_component_inventory_source_id": "nmlt-source-v1:sha256:29794c1eb78f28e9354417d1676c62b8109bd69ea20e4670b58bf9cee9f911d9"
  },
  "statement": "Kernel-checked structural exact-action safety congruence plus separate composability preservation for globally input-receptive open systems under whole-wiring equivalence.",
  "theorem_audits": [
    {
      "declared_axioms": [],
      "handle": "NMLT.Behavior.OpenComposition.StrongRefinement.compositionCongruence",
      "role": "congruence"
    },
    {
      "declared_axioms": [],
      "handle": "NMLT.Behavior.OpenComposition.StrongRefinement.parallelStepCongruence",
      "role": "congruence"
    },
    {
      "declared_axioms": [],
      "handle": "NMLT.Behavior.OpenComposition.parallelInputReceptive",
      "role": "receptiveness"
    },
    {
      "declared_axioms": [],
      "handle": "NMLT.Behavior.OpenComposition.StrongRefinement.outputCanSynchronize",
      "role": "synchronization"
    },
    {
      "declared_axioms": [],
      "handle": "NMLT.Behavior.OpenComposition.StrongRefinement.rightOutputCanSynchronize",
      "role": "synchronization"
    },
    {
      "declared_axioms": [],
      "handle": "NMLT.Behavior.OpenComposition.Examples.positiveCompositionCongruence",
      "role": "positive_control"
    },
    {
      "declared_axioms": [],
      "handle": "NMLT.Behavior.OpenComposition.Examples.positiveConcreteSynchronization",
      "role": "positive_control"
    },
    {
      "declared_axioms": [],
      "handle": "NMLT.Behavior.OpenComposition.Examples.peerOnlyWithEmptyWiring",
      "role": "positive_control"
    },
    {
      "declared_axioms": [],
      "handle": "NMLT.Behavior.OpenComposition.Examples.brokenWiringBlocksPeerOnly",
      "role": "negative_control"
    },
    {
      "declared_axioms": [],
      "handle": "NMLT.Behavior.OpenComposition.Examples.brokenWiringNotEquivalent",
      "role": "negative_control"
    },
    {
      "declared_axioms": [
        "propext"
      ],
      "handle": "NMLT.Counterexamples.CompositionCongruence.noCompositeRefinement",
      "role": "negative_control"
    }
  ],
  "toolchain": {
    "lean": "v4.30.0",
    "standard_library_only": true
  },
  "validation_gate": "./tools/check_metatheory.sh"
}
